{
  "schema_version": 1,
  "catalog_id": "implementation-presets",
  "catalog_version": "1.0.0",
  "review_policy": {
    "maximum_review_age_days": 180,
    "version_rule": "explicit-supported-stable-lines-only",
    "forbidden_references": [
      "latest",
      "current",
      "next",
      "canary",
      "beta",
      "rc"
    ],
    "reopen_triggers": [
      "security-advisory",
      "eol-announcement",
      "new-major-line",
      "removed-dependency-support",
      "failed-compatibility-validation"
    ]
  },
  "completeness_dimensions": [
    "quality",
    "security",
    "supply_chain",
    "testing",
    "operation",
    "verification"
  ],
  "sources": [
    {
      "source_id": "astro-support",
      "publisher": "Astro",
      "url": "https://docs.astro.build/en/upgrade-astro/",
      "verified_at": "2026-06-15",
      "supported_lines": [
        "Astro 6.x"
      ]
    },
    {
      "source_id": "docusaurus-releases",
      "publisher": "Meta Open Source",
      "url": "https://docusaurus.io/docs/versioning",
      "verified_at": "2026-06-15",
      "supported_lines": [
        "Docusaurus 3.x"
      ]
    },
    {
      "source_id": "rails-maintenance",
      "publisher": "Ruby on Rails",
      "url": "https://guides.rubyonrails.org/maintenance_policy.html",
      "verified_at": "2026-06-15",
      "supported_lines": [
        "Rails 8.1.x"
      ]
    },
    {
      "source_id": "postgres-versioning",
      "publisher": "PostgreSQL Global Development Group",
      "url": "https://www.postgresql.org/support/versioning/",
      "verified_at": "2026-06-15",
      "supported_lines": [
        "PostgreSQL 14.x",
        "PostgreSQL 15.x",
        "PostgreSQL 16.x",
        "PostgreSQL 17.x",
        "PostgreSQL 18.x"
      ]
    },
    {
      "source_id": "go-releases",
      "publisher": "The Go Authors",
      "url": "https://go.dev/doc/devel/release",
      "verified_at": "2026-06-15",
      "supported_lines": [
        "Go 1.25.x",
        "Go 1.26.x"
      ]
    },
    {
      "source_id": "node-releases",
      "publisher": "OpenJS Foundation",
      "url": "https://nodejs.org/en/about/previous-releases",
      "verified_at": "2026-06-15",
      "supported_lines": [
        "Node.js 24.x LTS"
      ]
    },
    {
      "source_id": "python-docs",
      "publisher": "Python Software Foundation",
      "url": "https://docs.python.org/3/contents.html",
      "verified_at": "2026-06-15",
      "supported_lines": [
        "Python 3.14.x"
      ]
    },
    {
      "source_id": "flutter-archive",
      "publisher": "Flutter project",
      "url": "https://docs.flutter.dev/install/archive",
      "verified_at": "2026-06-15",
      "supported_lines": [
        "Flutter 3.44.x stable"
      ]
    },
    {
      "source_id": "tauri-releases",
      "publisher": "Tauri Programme",
      "url": "https://v2.tauri.app/release/",
      "verified_at": "2026-06-15",
      "supported_lines": [
        "Tauri 2.x"
      ]
    },
    {
      "source_id": "dagster-releases",
      "publisher": "Dagster Labs",
      "url": "https://docs.dagster.io/about/releases",
      "verified_at": "2026-06-15",
      "supported_lines": [
        "Dagster stable 1.x"
      ]
    },
    {
      "source_id": "langgraph-overview",
      "publisher": "LangChain",
      "url": "https://docs.langchain.com/oss/python/langgraph/overview",
      "verified_at": "2026-06-15",
      "supported_lines": [
        "LangGraph stable 1.x"
      ]
    },
    {
      "source_id": "chi-releases",
      "publisher": "go-chi",
      "url": "https://github.com/go-chi/chi/releases",
      "verified_at": "2026-06-15",
      "supported_lines": [
        "locked stable release required"
      ]
    },
    {
      "source_id": "pgx-releases",
      "publisher": "jackc/pgx",
      "url": "https://github.com/jackc/pgx/releases",
      "verified_at": "2026-06-15",
      "supported_lines": [
        "locked stable release required"
      ]
    },
    {
      "source_id": "sqlc-releases",
      "publisher": "sqlc-dev",
      "url": "https://github.com/sqlc-dev/sqlc/releases",
      "verified_at": "2026-06-15",
      "supported_lines": [
        "locked stable release required"
      ]
    },
    {
      "source_id": "openapi-spec",
      "publisher": "OpenAPI Initiative",
      "url": "https://spec.openapis.org/oas/v3.2.0.html",
      "verified_at": "2026-06-15",
      "supported_lines": [
        "OpenAPI 3.2.0"
      ]
    },
    {
      "source_id": "hono-releases",
      "publisher": "Hono",
      "url": "https://github.com/honojs/hono/releases",
      "verified_at": "2026-06-15",
      "supported_lines": [
        "locked stable release required"
      ]
    },
    {
      "source_id": "nestjs-releases",
      "publisher": "NestJS",
      "url": "https://github.com/nestjs/nest/releases",
      "verified_at": "2026-06-15",
      "supported_lines": [
        "locked stable release required"
      ]
    },
    {
      "source_id": "spring-boot-support",
      "publisher": "Spring",
      "url": "https://spring.io/projects/spring-boot/",
      "verified_at": "2026-06-15",
      "supported_lines": [
        "Spring Boot 4.1.x"
      ]
    },
    {
      "source_id": "rust-install",
      "publisher": "Rust Project",
      "url": "https://www.rust-lang.org/tools/install/",
      "verified_at": "2026-06-15",
      "supported_lines": [
        "locked stable toolchain required"
      ]
    },
    {
      "source_id": "cobra-releases",
      "publisher": "spf13/cobra",
      "url": "https://github.com/spf13/cobra/releases",
      "verified_at": "2026-06-15",
      "supported_lines": [
        "locked stable release required"
      ]
    },
    {
      "source_id": "typer-releases",
      "publisher": "FastAPI",
      "url": "https://github.com/fastapi/typer/releases",
      "verified_at": "2026-06-15",
      "supported_lines": [
        "locked stable release required"
      ]
    },
    {
      "source_id": "expo-sdk",
      "publisher": "Expo",
      "url": "https://docs.expo.dev/versions/latest/",
      "verified_at": "2026-06-15",
      "supported_lines": [
        "Expo SDK 56.x"
      ]
    },
    {
      "source_id": "electron-timelines",
      "publisher": "Electron",
      "url": "https://www.electronjs.org/docs/latest/tutorial/electron-timelines",
      "verified_at": "2026-06-15",
      "supported_lines": [
        "locked supported Electron line required"
      ]
    },
    {
      "source_id": "parquet-docs",
      "publisher": "Apache Parquet",
      "url": "https://parquet.apache.org/docs/",
      "verified_at": "2026-06-15",
      "supported_lines": [
        "Parquet format specification"
      ]
    },
    {
      "source_id": "duckdb-docs",
      "publisher": "DuckDB",
      "url": "https://duckdb.org/docs/stable/installation",
      "verified_at": "2026-06-15",
      "supported_lines": [
        "DuckDB stable documentation line"
      ]
    },
    {
      "source_id": "polars-docs",
      "publisher": "Polars",
      "url": "https://pola.rs/",
      "verified_at": "2026-06-15",
      "supported_lines": [
        "locked stable release required"
      ]
    },
    {
      "source_id": "mlflow-docs",
      "publisher": "MLflow Project",
      "url": "https://mlflow.org/docs/latest/index.html",
      "verified_at": "2026-06-15",
      "supported_lines": [
        "locked stable release required"
      ]
    },
    {
      "source_id": "dbt-versions",
      "publisher": "dbt Labs",
      "url": "https://docs.getdbt.com/docs/dbt-versions",
      "verified_at": "2026-06-15",
      "supported_lines": [
        "dbt Core 1.11.x",
        "dbt Core 1.10.x"
      ]
    },
    {
      "source_id": "airflow-supported",
      "publisher": "Apache Airflow",
      "url": "https://airflow.apache.org/docs/apache-airflow/stable/installation/supported-versions.html",
      "verified_at": "2026-06-15",
      "supported_lines": [
        "Airflow 3.2.x stable"
      ]
    },
    {
      "source_id": "prefect-docs",
      "publisher": "Prefect",
      "url": "https://docs.prefect.io/v3/get-started",
      "verified_at": "2026-06-15",
      "supported_lines": [
        "Prefect 3.x"
      ]
    },
    {
      "source_id": "autogen-docs",
      "publisher": "Microsoft",
      "url": "https://microsoft.github.io/autogen/stable/",
      "verified_at": "2026-06-15",
      "supported_lines": [
        "AutoGen stable documentation line"
      ]
    }
  ],
  "presets": [
    {
      "preset_id": "content-astro-static",
      "family_id": "content-knowledge",
      "envelope": "Astro, TypeScript, content collections, static output and CDN delivery.",
      "invariants": [
        "repository-reviewable content",
        "static production output"
      ],
      "applicability": [
        "content-first sites"
      ],
      "contraindications": [
        "primary transactional workflow"
      ],
      "supported_profiles": [
        "content-delivery-surface"
      ],
      "supported_concerns": [
        "public-exposure"
      ],
      "fixed_decisions": [
        "Astro 6.x",
        "static output"
      ],
      "bounded_choices": [
        "CDN provider"
      ],
      "parameters": [
        "deployment region"
      ],
      "variants": [
        {
          "variant_id": "product-docs-docusaurus",
          "envelope_replacement": "Docusaurus 3.x product-documentation site.",
          "use_when": "versioned product documentation is primary"
        }
      ],
      "source_refs": [
        "astro-support",
        "docusaurus-releases"
      ],
      "reviewed_at": "2026-06-15",
      "review_by": "2026-12-12",
      "quality": "content schema and link checks",
      "security": "dependency audit and hosting headers",
      "supply_chain": "locked reproducible build",
      "testing": "unit, link and accessibility checks",
      "operation": "deploy, rollback and cache procedure",
      "verification": "preview and production artifact review"
    },